{
  "schema_version": 1,
  "tool": "search_graph",
  "profile": "analysis",
  "project": "demo",
  "graph": {
    "generation_id": "gen-20260817-0001",
    "indexed_at": "2026-08-17T01:00:00Z",
    "generated_at": "2026-08-17T01:00:05Z",
    "index_mode": "moderate",
    "indexed_commit": "1111111111111111111111111111111111111111"
  },
  "source": {
    "vcs": "git",
    "current_commit": "1111111111111111111111111111111111111111",
    "branch": "main",
    "worktree_state": "clean"
  },
  "freshness": {
    "status": "current",
    "basis": "mixed",
    "checked_at": "2026-08-17T01:05:00Z",
    "reason_codes": []
  },
  "coverage": {
    "status": "complete_no_known_gap",
    "signal": "best_effort",
    "recording_status": "complete",
    "generation_id": "gen-20260817-0001",
    "generation_match": true,
    "known_gap_count": 0,
    "excluded_count": 0,
    "hash_records_complete": true,
    "details_truncated": false
  },
  "result": {
    "status": "complete",
    "truncated": false,
    "returned": 12,
    "total": 12,
    "limit": 50,
    "has_more": false,
    "next_cursor": null,
    "truncation_reasons": []
  },
  "confidence": {
    "level": "best_effort",
    "reasons": ["static_graph_evidence", "generation_and_commit_match"]
  },
  "claim": {
    "status": "supported",
    "negative_claim_allowed": false,
    "reason_codes": ["static_analysis_cannot_prove_global_absence"]
  },
  "limitations": [
    {
      "code": "static_analysis_best_effort",
      "severity": "info",
      "message": "Dynamic calls, reflection, and runtime registration may be absent from the graph.",
      "scopes": ["demo"],
      "fallback_action": null
    }
  ]
}
