{
  "schema_version": 1,
  "tool": "index_status",
  "profile": "all",
  "project": "plain-folder",
  "graph": {
    "generation_id": "gen-20260817-0002",
    "indexed_at": "2026-08-17T02:00:00Z",
    "generated_at": "2026-08-17T02:00:02Z",
    "index_mode": "fast",
    "indexed_commit": null
  },
  "source": {
    "vcs": "none",
    "current_commit": null,
    "branch": null,
    "worktree_state": "not_applicable"
  },
  "freshness": {
    "status": "unknown",
    "basis": "unavailable",
    "checked_at": "2026-08-17T02:05:00Z",
    "reason_codes": ["no_git"]
  },
  "coverage": {
    "status": "complete_no_known_gap",
    "signal": "best_effort",
    "recording_status": "complete",
    "generation_id": "gen-20260817-0002",
    "generation_match": true,
    "known_gap_count": 0,
    "excluded_count": 0,
    "hash_records_complete": true,
    "details_truncated": false
  },
  "result": {
    "status": "complete",
    "truncated": false,
    "returned": null,
    "total": null,
    "limit": null,
    "has_more": null,
    "next_cursor": null,
    "truncation_reasons": []
  },
  "confidence": {
    "level": "unknown",
    "reasons": ["project_level_source_freshness_not_verified"]
  },
  "claim": {
    "status": "provisional",
    "negative_claim_allowed": false,
    "reason_codes": ["freshness_unknown"]
  },
  "limitations": [
    {
      "code": "no_git_freshness_evidence",
      "severity": "warning",
      "message": "Project-level freshness cannot be inferred without Git or a complete content verification.",
      "scopes": ["plain-folder"],
      "fallback_action": "verify_content_hashes"
    }
  ]
}
